<?xml version="1.0" encoding="UTF-8" standalone="no"?>
<list xmlns:xsi="http://www.w3.org/2001/XMLSchema-instance" xmlns="http://l2j.org" xsi:schemaLocation="http://l2j.org skills.xsd">
    <skill id="17608" name="Energy of Delusion" action="A2">
        <!-- Fishing place, filled with Fantastical Energy. -->
        <icon initial="icon.etc_dragons_blood_i03"/>
        <attributes>
            <cast-range initial="-1"/>
        </attributes>
        <target/>
    </skill>
    <skill id="17613" name="Summon Agathion Aries" action="A1">
        <!-- Summons an agathion. -->
        <icon initial="icon.etc_summon_aga_agit_i00"/>
        <attributes>
            <magic-level initial="85"/>
            <cast-range initial="-1"/>
            <hit-time initial="3000"/>
        </attributes>
        <target/>
        <effects>
            <summon-agathion id="13411"/>
        </effects>
    </skill>
    <skill id="17619" name="Summon Agathion Pisces" action="A1">
        <!-- Summons an agathion. -->
        <icon initial="icon.etc_summon_aga_agit_i00"/>
        <attributes>
            <magic-level initial="85"/>
            <cast-range initial="-1"/>
            <hit-time initial="3000"/>
        </attributes>
        <target/>
        <effects>
            <summon-agathion id="13407"/>
        </effects>
    </skill>
    <skill id="17621" name="Summon Agathion Cancer" action="A1">
        <!-- Summons an agathion. -->
        <icon initial="icon.etc_summon_aga_agit_i00"/>
        <attributes>
            <magic-level initial="85"/>
            <cast-range initial="-1"/>
            <hit-time initial="3000"/>
        </attributes>
        <target/>
        <effects>
            <summon-agathion id="13409"/>
        </effects>
    </skill>
    <skill id="17625" name="Agathion Cute Trick - Aries" action="A1">
        <!-- Makes an agathion perform a cute trick. -->
        <icon initial="icon.skill_agathion_cute"/>
        <attributes>
            <cast-range initial="-1"/>
            <hit-time initial="3000"/>
        </attributes>
        <target/>
    </skill>
    <skill id="17685" name="Uldie's Gift" action="A1">
        <!--  -->
        <icon initial="icon.skill0000"/>
        <attributes>
            <cast-range initial="-1"/>
            <effect-point initial="1"/>
        </attributes>
        <target/>
    </skill>
    <skill id="17686" name="Uldie's Energy" max-level="2" action="A2">
        <!-- 
			level 1: Buff from Uldie. For 2 h., Acquired XP/ SP +10%, P./ M. Atk. +5%, Atk. Spd./ Casting Spd. +5%. A chance to obtain Uldie's Elite Gift when the buff is cancelled.  Note! The gift can't be obtained if your character is dead or if there is no space in your inventory.
			level 2: Buff from Uldie.
		-->
        <icon initial="BranchSys.icon.br_sevenlove_girlpresent_i00"/>
        <attributes>
            <cast-range initial="900">
                <value level="2">-1</value>
            </cast-range>
            <effect-point initial="1"/>
        </attributes>
        <target/>
    </skill>
    <skill id="17689" name="Uldie's Valuable Gift" action="A1">
        <!-- none -->
        <icon initial="icon.skill0000"/>
        <attributes>
            <cast-range initial="-1"/>
        </attributes>
        <target/>
    </skill>
    <skill id="17695" name="Squash Seed" action="A1">
        <!-- Skill for summoning a Pumpkin for an anniversary. -->
        <icon initial="icon.skill17695"/>
        <attributes>
            <cast-range initial="-1"/>
            <reuse initial="5000"/>
            <cool-time initial="500"/>
            <hit-time initial="1000"/>
        </attributes>
        <target/>
    </skill>
    <skill id="17696" name="Cloned Large Squash Seed" action="A1">
        <!-- Skill for summoning a Pumpkin for an anniversary. -->
        <icon initial="icon.skill17696"/>
        <attributes>
            <cast-range initial="-1"/>
            <reuse initial="5000"/>
            <cool-time initial="500"/>
            <hit-time initial="1000"/>
        </attributes>
        <target/>
    </skill>
</list>
