<?xml version="1.0" encoding="UTF-8" standalone="no"?>
<list xmlns:xsi="http://www.w3.org/2001/XMLSchema-instance" xmlns="http://l2j.org" xsi:schemaLocation="http://l2j.org skills.xsd">
    <skill id="14826" name="Intense Slash" max-level="9" action="A1">
        <!-- 
			level 1: Concentrates the spirit energy to deal physical damage to the target. Power 831.
			level 2: Concentrates the spirit energy to deal physical damage to the target. Power 8287.
			level 3: Concentrates the spirit energy to deal physical damage to the target. Power 400.
			level 4: Concentrates the spirit energy to deal physical damage to the target. Power 831.
			level 5: Concentrates the spirit energy to deal physical damage to the target. Power 1532.
			level 6: Concentrates the spirit energy to deal physical damage to the target. Power 2575.
			level 7: Concentrates the spirit energy to deal physical damage to the target. Power 4430.
			level 8: Concentrates the spirit energy to deal physical damage to the target. Power 6656.
			level 9: Concentrates the spirit energy to deal physical damage to the target. Power 8287.
		-->
        <icon initial="icon.skill_transform_s_attack"/>
        <attributes magic-critical-rate="-5.0">
            <cast-range initial="-1"/>
            <reuse initial="5000"/>
            <cool-time initial="500"/>
            <effect-point initial="-183"/>
            <hit-time initial="2500"/>
        </attributes>
        <target affect-min="6" affect-random="12" object="NOT_FRIEND" range="150" scope="RANGE" type="ENEMY"/>
        <effects>
            <physical-attack>
                <power initial="831.0">
                    <value level="2">8287.0</value>
                    <value level="3">400.0</value>
                    <value level="4">831.0</value>
                    <value level="5">1532.0</value>
                    <value level="6">2575.0</value>
                    <value level="7">4430.0</value>
                    <value level="8">6656.0</value>
                    <value level="9">8287.0</value>
                </power>
            </physical-attack>
        </effects>
    </skill>
    <skill id="14828" name="Purity Blast" max-level="9" action="A1" type="MAGIC">
        <!-- 
			level 1: Inflicts damage on nearby enemies with 50 Power added to M. Atk. using the power of holy magic.
			level 2: Inflicts damage on nearby enemies with 120 Power added to M. Atk. using the power of holy magic.
			level 3: Inflicts damage on nearby enemies with 39 Power added to M. Atk. using the power of holy magic.
			level 4: Inflicts damage on nearby enemies with 50 Power added to M. Atk. using the power of holy magic.
			level 5: Inflicts damage on nearby enemies with 66 Power added to M. Atk. using the power of holy magic.
			level 6: Inflicts damage on nearby enemies with 82 Power added to M. Atk. using the power of holy magic.
			level 7: Inflicts damage on nearby enemies with 94 Power added to M. Atk. using the power of holy magic.
			level 8: Inflicts damage on nearby enemies with 108 Power added to M. Atk. using the power of holy magic.
			level 9: Inflicts damage on nearby enemies with 120 Power added to M. Atk. using the power of holy magic.
		-->
        <icon initial="icon.skill_transform_s_attack"/>
        <attributes magic-critical-rate="-5.0">
            <cast-range initial="500"/>
            <reuse initial="7000"/>
            <cool-time initial="500"/>
            <effect-point initial="-183"/>
            <effect-range initial="1000"/>
            <hit-time initial="2500"/>
        </attributes>
        <target affect-min="5" affect-random="12" object="NOT_FRIEND" range="200" scope="RANGE" type="ENEMY"/>
        <effects>
            <magical-attack>
                <power initial="50.0">
                    <value level="2">120.0</value>
                    <value level="3">39.0</value>
                    <value level="4">50.0</value>
                    <value level="5">66.0</value>
                    <value level="6">82.0</value>
                    <value level="7">94.0</value>
                    <value level="8">108.0</value>
                    <value level="9">120.0</value>
                </power>
            </magical-attack>
        </effects>
    </skill>
    <skill id="14830" name="Gray Explosion" max-level="9" action="A1">
        <!-- 
			level 1: Deals damage to the target with 985 Power using the power of a devout heart.
			level 2: Deals damage to the target with 9861 Power using the power of a devout heart.
			level 3: Deals damage to the target with 473 Power using the power of a devout heart.
			level 4: Deals damage to the target with 985 Power using the power of a devout heart.
			level 5: Deals damage to the target with 1814 Power using the power of a devout heart.
			level 6: Deals damage to the target with 3048 Power using the power of a devout heart.
			level 7: Deals damage to the target with 5269 Power using the power of a devout heart.
			level 8: Deals damage to the target with 7904 Power using the power of a devout heart.
			level 9: Deals damage to the target with 9861 Power using the power of a devout heart.
		-->
        <icon initial="icon.skill_transform_s_attack"/>
        <attributes magic-critical-rate="-5.0">
            <cast-range initial="-1"/>
            <reuse initial="5000"/>
            <cool-time initial="500"/>
            <effect-point initial="-183"/>
            <hit-time initial="2500"/>
        </attributes>
        <target affect-min="6" affect-random="12" object="NOT_FRIEND" range="150" scope="RANGE" type="ENEMY"/>
        <effects>
            <physical-attack>
                <power initial="985.0">
                    <value level="2">9861.0</value>
                    <value level="3">473.0</value>
                    <value level="4">985.0</value>
                    <value level="5">1814.0</value>
                    <value level="6">3048.0</value>
                    <value level="7">5269.0</value>
                    <value level="8">7904.0</value>
                    <value level="9">9861.0</value>
                </power>
            </physical-attack>
        </effects>
    </skill>
    <skill id="14832" name="Platonic Tempest" max-level="9" action="A1" type="MAGIC">
        <!-- 
			level 1: Inflicts magical damage on nearby enemies with 55 Power added to M. Atk. by fully concentrating on holy magic.
			level 2: Inflicts magical damage on nearby enemies with 133 Power added to M. Atk. by fully concentrating on holy magic.
			level 3: Inflicts magical damage on nearby enemies with 43 Power added to M. Atk. by fully concentrating on holy magic.
			level 4: Inflicts magical damage on nearby enemies with 55 Power added to M. Atk. by fully concentrating on holy magic.
			level 5: Inflicts magical damage on nearby enemies with 72 Power added to M. Atk. by fully concentrating on holy magic.
			level 6: Inflicts magical damage on nearby enemies with 91 Power added to M. Atk. by fully concentrating on holy magic.
			level 7: Inflicts magical damage on nearby enemies with 104 Power added to M. Atk. by fully concentrating on holy magic.
			level 8: Inflicts magical damage on nearby enemies with 120 Power added to M. Atk. by fully concentrating on holy magic.
			level 9: Inflicts magical damage on nearby enemies with 133 Power added to M. Atk. by fully concentrating on holy magic.
		-->
        <icon initial="icon.skill_transform_s_attack"/>
        <attributes magic-critical-rate="-5.0">
            <magic-level initial="40">
                <value level="2">85</value>
                <value level="3">30</value>
                <value level="4">40</value>
                <value level="5">50</value>
                <value level="6">60</value>
                <value level="7">70</value>
                <value level="8">80</value>
                <value level="9">85</value>
            </magic-level>
            <cast-range initial="500"/>
            <reuse initial="7000"/>
            <cool-time initial="500"/>
            <effect-point initial="-183"/>
            <effect-range initial="1000"/>
            <hit-time initial="2500"/>
        </attributes>
        <target affect-min="5" affect-random="12" object="NOT_FRIEND" range="200" scope="RANGE" type="ENEMY"/>
        <effects>
            <magical-attack>
                <power initial="55.0">
                    <value level="2">133.0</value>
                    <value level="3">43.0</value>
                    <value level="4">55.0</value>
                    <value level="5">72.0</value>
                    <value level="6">91.0</value>
                    <value level="7">104.0</value>
                    <value level="8">120.0</value>
                    <value level="9">133.0</value>
                </power>
            </magical-attack>
        </effects>
    </skill>
</list>
