<?xml version="1.0" encoding="UTF-8" standalone="no"?>
<list xmlns:xsi="http://www.w3.org/2001/XMLSchema-instance" xmlns="http://l2j.org" xsi:schemaLocation="http://l2j.org skills.xsd">
    <skill id="49100" name="Pet HP Recovery Potion">
        <!--  -->
        <icon initial="icon.skill0000"/>
        <attributes/>
        <target/>
    </skill>
    <skill id="49101" name="1st Pet Evolution">
        <!--  -->
        <icon initial="icon.skill0000"/>
        <attributes/>
        <target/>
    </skill>
    <skill id="49102" name="2nd Pet Evolution">
        <!--  -->
        <icon initial="icon.skill0000"/>
        <attributes/>
        <target/>
    </skill>
</list>
