<?xml version="1.0" encoding="UTF-8" standalone="no"?>
<list xmlns:xsi="http://www.w3.org/2001/XMLSchema-instance" xmlns="http://l2j.org" xsi:schemaLocation="http://l2j.org skills.xsd">
    <skill id="60300" name="P. Evasion: 100 - Healing 30%">
        <!-- P. Evasion: 100 - Healing 30%% -->
        <icon initial="iccon.skill0000"/>
        <attributes/>
        <target/>
    </skill>
    <skill id="60301" name="Equipped Shield - Atk. Spd. +100%">
        <!-- Equipped Shield - Atk. Spd.: +100%% -->
        <icon initial="iccon.skill0000"/>
        <attributes/>
        <target/>
    </skill>
    <skill id="60302" name="Equipped Shield - Atk. Spd. +100">
        <!-- Equipped Shield - Atk. Spd. +100 -->
        <icon initial="iccon.skill0000"/>
        <attributes/>
        <target/>
    </skill>
    <skill id="60303" name="Atk. Spd.: 100% - Healing 60%">
        <!-- Atk. Spd.: 100%% - Healing 60%% -->
        <icon initial="iccon.skill0000"/>
        <attributes/>
        <target/>
    </skill>
    <skill id="60304" name="Atk. Spd.: 100 - Healing 60%">
        <!-- Atk. Spd.: 100 - Healing 60%% -->
        <icon initial="iccon.skill0000"/>
        <attributes/>
        <target/>
    </skill>
    <skill id="60305" name="Atk. Spd.: 100% - Healing 30%">
        <!-- Atk. Spd.: 100%% - Healing 30%% -->
        <icon initial="iccon.skill0000"/>
        <attributes/>
        <target/>
    </skill>
    <skill id="60306" name="Atk. Spd.: 100 - Healing 30%">
        <!-- Atk. Spd.: 100 - Healing 30%% -->
        <icon initial="iccon.skill0000"/>
        <attributes/>
        <target/>
    </skill>
    <skill id="60307" name="Speed: 100 - Out of combat">
        <!-- Speed: 100 - Out of combat -->
        <icon initial="iccon.skill0000"/>
        <attributes/>
        <target/>
    </skill>
    <skill id="60308" name="P. Atk.: Increase due to the level">
        <!-- P. Atk.: Increase due to the level -->
        <icon initial="iccon.skill0000"/>
        <attributes/>
        <target/>
    </skill>
    <skill id="60309" name="M. Atk.: Increase due to the level">
        <!-- M. Atk.: Increase due to the level -->
        <icon initial="iccon.skill0000"/>
        <attributes/>
        <target/>
    </skill>
    <skill id="60310" name="P. Def.: Increase due to the level">
        <!-- P. Def.: Increase due to the level -->
        <icon initial="iccon.skill0000"/>
        <attributes/>
        <target/>
    </skill>
    <skill id="60311" name="M. Def.: Increase due to the level">
        <!-- M. Def.: Increase due to the level -->
        <icon initial="iccon.skill0000"/>
        <attributes/>
        <target/>
    </skill>
    <skill id="60312" name="P. Accuracy: Increase due to the level">
        <!-- P. Accuracy: Increase due to the level -->
        <icon initial="iccon.skill0000"/>
        <attributes/>
        <target/>
    </skill>
    <skill id="60313" name="M. Accuracy: Increase due to the level">
        <!-- M. Accuracy: Increase due to the level -->
        <icon initial="iccon.skill0000"/>
        <attributes/>
        <target/>
    </skill>
    <skill id="60314" name="P. Evasion: Increase due to the level">
        <!-- P. Evasion: Increase due to the level -->
        <icon initial="iccon.skill0000"/>
        <attributes/>
        <target/>
    </skill>
    <skill id="60315" name="M. Evasion: Increase due to the level">
        <!-- M. Evasion: Increase due to the level -->
        <icon initial="iccon.skill0000"/>
        <attributes/>
        <target/>
    </skill>
    <skill id="60316" name="Atk. Spd.: Increase due to the level">
        <!-- Atk. Spd.: Increase due to the level -->
        <icon initial="iccon.skill0000"/>
        <attributes/>
        <target/>
    </skill>
    <skill id="60317" name="Casting Spd.: Increase due to the level">
        <!-- Casting Spd.: Increase due to the level -->
        <icon initial="iccon.skill0000"/>
        <attributes/>
        <target/>
    </skill>
    <skill id="60318" name="P. Accuracy: Heavy Armor - 100%">
        <!-- P. Accuracy: Heavy Armor - 100%% -->
        <icon initial="iccon.skill0000"/>
        <attributes/>
        <target/>
    </skill>
    <skill id="60319" name="P. Accuracy: Heavy Armor - 100">
        <!-- P. Accuracy: Heavy Armor - 100 -->
        <icon initial="iccon.skill0000"/>
        <attributes/>
        <target/>
    </skill>
    <skill id="60320" name="P. Accuracy: Light Armor - 100%">
        <!-- P. Accuracy: Light Armor - 100%% -->
        <icon initial="iccon.skill0000"/>
        <attributes/>
        <target/>
    </skill>
    <skill id="60321" name="P. Accuracy: Light Armor - 100">
        <!-- P. Accuracy: Light Armor - 100 -->
        <icon initial="iccon.skill0000"/>
        <attributes/>
        <target/>
    </skill>
    <skill id="60322" name="P. Accuracy: Robe - 100%">
        <!-- P. Accuracy: Robe - 100%% -->
        <icon initial="iccon.skill0000"/>
        <attributes/>
        <target/>
    </skill>
    <skill id="60323" name="P. Accuracy: Robe - 100">
        <!-- P. Accuracy: Robe - 100 -->
        <icon initial="iccon.skill0000"/>
        <attributes/>
        <target/>
    </skill>
    <skill id="60324" name="P. Accuracy: All - 100%">
        <!-- P. Accuracy: All - 100%% -->
        <icon initial="iccon.skill0000"/>
        <attributes/>
        <target/>
    </skill>
    <skill id="60325" name="P. Accuracy: All - 100">
        <!-- P. Accuracy: All - 100 -->
        <icon initial="iccon.skill0000"/>
        <attributes/>
        <target/>
    </skill>
    <skill id="60326" name="Speed: Increase due to the level">
        <!-- Speed: Increase due to the level -->
        <icon initial="iccon.skill0000"/>
        <attributes/>
        <target/>
    </skill>
    <skill id="60327" name="M. Accuracy: 100%">
        <!-- M. Accuracy: 100%% -->
        <icon initial="iccon.skill0000"/>
        <attributes/>
        <target/>
    </skill>
    <skill id="60328" name="M. Accuracy: +100">
        <!-- M. Accuracy: +100 -->
        <icon initial="iccon.skill0000"/>
        <attributes/>
        <target/>
    </skill>
    <skill id="60329" name="M. Evasion: 100%">
        <!-- M. Evasion: 100%% -->
        <icon initial="iccon.skill0000"/>
        <attributes/>
        <target/>
    </skill>
    <skill id="60330" name="M. Evasion: 100">
        <!-- M. Evasion: 100 -->
        <icon initial="iccon.skill0000"/>
        <attributes/>
        <target/>
    </skill>
    <skill id="60331" name="Casting Spd. - Bow: 100%">
        <!-- Casting Spd. - Bow: 100%% -->
        <icon initial="iccon.skill0000"/>
        <attributes/>
        <target/>
    </skill>
    <skill id="60332" name="Casting Spd. - Bow: 100">
        <!-- Casting Spd. - Bow: 100 -->
        <icon initial="iccon.skill0000"/>
        <attributes/>
        <target/>
    </skill>
</list>
