<?xml version="1.0" encoding="UTF-8" standalone="no"?>
<list xmlns:xsi="http://www.w3.org/2001/XMLSchema-instance" xmlns="http://l2j.org" xsi:schemaLocation="http://l2j.org skills.xsd">
    <skill id="7122" name="Raid Boss (Lv. 80)">
        <!-- Enchanted by Shillien, enshrouded in darkness, Antharas' minion is guarding the lands near the Ant Nest. -->
        <icon initial="icon.skillraid"/>
        <attributes/>
        <target/>
    </skill>
    <skill id="7123" name="Raid Boss (Lv. 80)">
        <!-- Enchanted by Shillien, enshrouded in darkness, Giran is guarding the lands and praying about resurrection. -->
        <icon initial="icon.skillraid"/>
        <attributes/>
        <target/>
    </skill>
    <skill id="7124" name="Raid Boss (Lv. 80)">
        <!-- Enchanted by Shillien, enshrouded in darkness, minion of Core is guarding the lands around Cruma Tower. -->
        <icon initial="icon.skillraid"/>
        <attributes/>
        <target/>
    </skill>
    <skill id="7125" name="Raid Boss (Lv. 80)">
        <!-- Enchanted by Shillien, enshrouded in darkness, minion of Orfen is guarding the Plains of the Lizardmen. -->
        <icon initial="icon.skillraid"/>
        <attributes/>
        <target/>
    </skill>
    <skill id="7126" name="Master's Blessing - Holy Weapon" max-level="3" action="A1">
        <!-- 
			level 1: The GM is always by your side. For 1 h., party members' Holy Attack +20.
			level 2: The GM is always by your side. For 4 h., party members' Holy Attack +20.
			level 3: The GM is always by your side. For 8 h., party members' Holy Attack +20.
		-->
        <icon initial="icon.skill1043"/>
        <attributes>
            <cast-range initial="900"/>
            <reuse initial="1000"/>
            <effect-point initial="243"/>
            <hit-time initial="500"/>
        </attributes>
        <target/>
    </skill>
    <skill id="7127" name="Master's Blessing - Stun Resistance" max-level="3" action="A1">
        <!-- 
			level 1: The GM is always by your side. For 1 h., Stun Resistance +40%%.
			level 2: The GM is always by your side. For 4 h., Stun Resistance +40%%.
			level 3: The GM is always by your side. For 8 h., Stun Resistance +40%%.
		-->
        <icon initial="icon.skill1259"/>
        <attributes>
            <cast-range initial="900"/>
            <reuse initial="1000"/>
            <effect-point initial="646"/>
            <hit-time initial="500"/>
        </attributes>
        <target/>
    </skill>
    <skill id="7129" name="Triple Sonic Slash" max-level="4" action="A1">
        <!--  -->
        <icon initial="icon.skill0000"/>
        <attributes>
            <cast-range initial="40"/>
            <reuse initial="30000"/>
            <effect-point initial="-100"/>
            <hit-time initial="1800"/>
        </attributes>
        <consume>
            <mana initial="159">
                <value level="2">165</value>
                <value level="3">168</value>
                <value level="4">170</value>
            </mana>
        </consume>
        <target/>
    </skill>
    <skill id="7130" name="Sonic Blaster" max-level="4" action="A1">
        <!--  -->
        <icon initial="icon.skill0000"/>
        <attributes>
            <cast-range initial="600"/>
            <reuse initial="15000"/>
            <effect-point initial="-100"/>
            <hit-time initial="1900"/>
        </attributes>
        <consume>
            <mana initial="80">
                <value level="2">83</value>
                <value level="3">84</value>
                <value level="4">85</value>
            </mana>
        </consume>
        <target/>
    </skill>
</list>
