<?xml version="1.0" encoding="UTF-8" standalone="no"?>
<list xmlns:xsi="http://www.w3.org/2001/XMLSchema-instance" xmlns="http://l2j.org" xsi:schemaLocation="http://l2j.org skills.xsd">
    <skill id="52001" name="Flag Display">
        <!-- In order to get recognition, display the combat flag on the fortress' flagpole. -->
        <icon initial="icon.weapon_fort_flag_i00"/>
        <attributes/>
        <target/>
    </skill>
    <skill id="52002" name="Flag Power - Warrior" debuff="true">
        <!-- Flag Power for warriors. Decreases nearby enemies’ Speed. -->
        <icon initial="icon.skill1298"/>
        <attributes/>
        <target/>
    </skill>
    <skill id="52003" name="Flag Power - Knight">
        <!-- Flag Power for knights. Increases P./ M. Def. and Debuff Resistance. -->
        <icon initial="icon.skill0110"/>
        <attributes/>
        <target/>
    </skill>
    <skill id="52004" name="Flag Power - Rogue">
        <!-- Flag Power for rogues. Increases P. Evasion и P. Skill Evasion. -->
        <icon initial="icon.skill0111"/>
        <attributes/>
        <target/>
    </skill>
    <skill id="52005" name="Flag Power - Archer">
        <!-- Flag Power for archers. Increases P. Evasion и P. Skill Evasion. -->
        <icon initial="icon.skill0111"/>
        <attributes/>
        <target/>
    </skill>
    <skill id="52006" name="Flag Power - Mage" debuff="true" type="MAGIC">
        <!-- Flag power for mages. Inflicts Sleep on nearby enemies. -->
        <icon initial="icon.skill1072"/>
        <attributes/>
        <target/>
    </skill>
    <skill id="52007" name="Flag Power - Summoner" debuff="true" type="MAGIC">
        <!-- Flag power for summoners. Inflicts Stun on nearby enemies. -->
        <icon initial="icon.skill0048"/>
        <attributes/>
        <target/>
    </skill>
    <skill id="52008" name="Flag Power - Healer" debuff="true" type="MAGIC">
        <!-- Flag power for healers. Inflicts Sleep on nearby enemies. -->
        <icon initial="icon.skill1072"/>
        <attributes/>
        <target/>
    </skill>
    <skill id="52009" name="Flag Power - Enchanter" debuff="true" type="MAGIC">
        <!-- Flag power for enchanters. Inflicts Hold on nearby enemies. -->
        <icon initial="icon.skill1201"/>
        <attributes/>
        <target/>
    </skill>
    <skill id="52010" name="Flag Power - Bard" debuff="true">
        <!-- Flag power for bards. Inflicts Stun on nearby enemies. -->
        <icon initial="icon.skill0048"/>
        <attributes/>
        <target/>
    </skill>
    <skill id="52011" name="Flag Power - Shaman" debuff="true" type="MAGIC">
        <!-- Flag power for shamans. Inflicts Fear on nearby enemies. -->
        <icon initial="icon.skill1092"/>
        <attributes/>
        <target/>
    </skill>
    <skill id="52012" name="Flag Power - Fast Run">
        <!-- Flag Power temporarily increases Speed. -->
        <icon initial="icon.skill0004"/>
        <attributes/>
        <target/>
    </skill>
    <skill id="52013" name="Flag Equip">
        <!-- Speed of the flag bearer is decreased. -->
        <icon initial="icon.weapon_fort_flag_i00"/>
        <attributes/>
        <target/>
    </skill>
    <skill id="52014" name="Get Combat Flag">
        <!-- You have got the power of Combat Flag. -->
        <icon initial="icon.weapon_fort_flag_i00"/>
        <attributes/>
        <target/>
    </skill>
    <skill id="52015" name="Drop Combat Flag">
        <!-- You have lost the power of Combat Flag. -->
        <icon initial="icon.weapon_fort_flag_i00"/>
        <attributes/>
        <target/>
    </skill>
    <skill id="52016" name="Orc Fortress Siege">
        <!-- A special ability given to the clan members who own the Orc Fortress.\nAcquired XP/ SP +30%, gained adena +20%. -->
        <icon initial="icon.skill32121"/>
        <attributes/>
        <target/>
    </skill>
    <skill id="52017" name="Remote Flag Display">
        <!-- In order to get recognition, display the combat flag on the fortress' flagpole. There's a chance to fail. -->
        <icon initial="icon.weapon_fort_flag_i00"/>
        <attributes/>
        <target/>
    </skill>
    <skill id="52018" name="Leader Power">
        <!-- STR +1\nINT +1\nP. Evasion +20\nHP Recovery Potions' Effect +10 -->
        <icon initial="icon.1st_ranking_share_buff"/>
        <attributes/>
        <target/>
    </skill>
    <skill id="52019" name="PvP Ranking">
        <!-- Bonus for the 1st-3rd places in PvP Ranking. When you have killed, you can see a special visual effect for a short period of time. -->
        <icon initial="icon.pvp_ranking"/>
        <attributes/>
        <target/>
    </skill>
    <skill id="52020" name="PvP Ranking Effect">
        <!--  -->
        <icon initial="icon.skill0000"/>
        <attributes/>
        <target/>
    </skill>
    <skill id="52021" name="Vitality Clan Bonus">
        <!-- Sayha's Grace charging rate +5% -->
        <icon initial="icon.skill19005"/>
        <attributes/>
        <target/>
    </skill>
    <skill id="52022" name="Sylph Blessing">
        <!-- Atk. Spd. +50\nCasting Spd. +50\nSpeed +5\nSoulshot Damage +10%\nSpiritshot Damage +10%\nAcquired XP/ SP +30% -->
        <icon initial="icon.ev_sylph_bless"/>
        <attributes/>
        <target/>
    </skill>
</list>
