<?xml version="1.0" encoding="UTF-8" standalone="no"?>
<list xmlns:xsi="http://www.w3.org/2001/XMLSchema-instance" xmlns="http://l2j.org" xsi:schemaLocation="http://l2j.org skills.xsd">
    <skill id="39465" name="Anniversary Celebration Transformation" action="A1" type="MAGIC">
        <!-- For 60 min. transforms into a White Dog. Speed +20.\nThe effect can be removed with Alt+Mouse Left Click. -->
        <icon initial="icon.skill11540"/>
        <attributes>
            <cast-range initial="-1"/>
            <reuse initial="600000"/>
            <cool-time initial="500"/>
            <effect-point initial="1"/>
            <hit-time initial="1500"/>
        </attributes>
        <target/>
    </skill>
    <skill id="39466" name="Anniversary Talisman">
        <!-- Acquired XP/ SP +15%. -->
        <icon initial="icon.ev_L2_soul_ore"/>
        <attributes/>
        <target/>
    </skill>
</list>
