<?xml version="1.0" encoding="UTF-8" standalone="no"?>
<list xmlns:xsi="http://www.w3.org/2001/XMLSchema-instance" xmlns="http://l2j.org" xsi:schemaLocation="http://l2j.org skills.xsd">
    <skill id="2531" name="Scroll of Escape (Novice)" action="A1">
        <!-- none -->
        <icon initial="icon.skill0000"/>
        <attributes magic-critical-rate="5.0">
            <magic-level initial="1"/>
            <cast-range initial="-1"/>
            <hit-time initial="20000"/>
        </attributes>
        <target/>
        <conditions>
            <condition name="OpCanEscape"/>
        </conditions>
        <effects>
            <escape location="TOWN"/>
        </effects>
    </skill>
    <skill id="2584" name="Item - Special Sound Crystal" action="A1">
        <!-- none -->
        <icon initial="icon.skill0000"/>
        <attributes magic-critical-rate="5.0">
            <magic-level initial="1"/>
            <cast-range initial="-1"/>
        </attributes>
        <target/>
    </skill>
    <skill id="2585" name="Item - Special Sound Crystal" action="A1">
        <!-- none -->
        <icon initial="icon.skill0000"/>
        <attributes magic-critical-rate="5.0">
            <magic-level initial="1"/>
            <cast-range initial="-1"/>
        </attributes>
        <target/>
    </skill>
    <skill id="2587" name="Additional My Teleport slots" action="A1">
        <!-- none -->
        <icon initial="icon.skill0000"/>
        <attributes magic-critical-rate="5.0">
            <magic-level initial="1"/>
            <cast-range initial="-1"/>
        </attributes>
        <target/>
        <conditions>
            <can-add-bookmark-slot slots="3"/>
        </conditions>
        <effects>
            <effect name="AddTeleportBookmarkSlot">
                <power initial="3.0"/>
            </effect>
        </effects>
    </skill>
    <skill id="2588" name="My Teleport" action="A1">
        <!-- none -->
        <icon initial="icon.skill0000"/>
        <attributes magic-critical-rate="5.0">
            <magic-level initial="1"/>
            <cast-range initial="-1"/>
        </attributes>
        <target/>
    </skill>
</list>
