<?xml version="1.0" encoding="UTF-8" standalone="no"?>
<list xmlns:xsi="http://www.w3.org/2001/XMLSchema-instance" xmlns="http://l2j.org" xsi:schemaLocation="http://l2j.org skills.xsd">
    <skill id="8522" name="Summon Agathion Nevit's Messenger Kanna" action="A1">
        <!-- Summons an agathion. -->
        <icon initial="icon.etc_summon_aga_agit_i00"/>
        <attributes magic-critical-rate="5.0">
            <magic-level initial="85"/>
            <cast-range initial="-1"/>
            <hit-time initial="3000"/>
        </attributes>
        <target/>
        <effects>
            <summon-agathion id="16078"/>
        </effects>
    </skill>
</list>
